Cites,Authors,Title,Year,Source,Publisher,ArticleURL,CitesURL,GSRank,QueryDate,Type,DOI,ISSN,CitationURL,Volume,Issue,StartPage,EndPage,ECC,CitesPerYear,CitesPerAuthor,AuthorCount,Age
3,M Pomponio,Method for automated documentation of structured query language including workflow and data dependencies,2015,"US Patent App. 14/394,995",Google Patents,https://patents.google.com/patent/US20150095378A1/en,"https://scholar.google.com/scholar?cites=9054228755952801609&as_sdt=2005&sciodt=0,5&hl=en",751,25-01-21,,,,,,,,,3,0.5,3,1,6
2,"C Potter, K Buchler, B Dachevski, ...",System and method of model action logging,2005,US Patent App. 10 …,Google Patents,https://patents.google.com/patent/US20050021278A1/en,"https://scholar.google.com/scholar?cites=11264216095545108089&as_sdt=2005&sciodt=0,5&hl=en",752,25-01-21,,,,,,,,,2,0.13,1,4,16
62,"JA Fontana, AR Pitchford, CE Smith, ...",Method and system for interfacing to a variety of software development tools,2001,US Patent …,Google Patents,https://patents.google.com/patent/US6170081B1/en,"https://scholar.google.com/scholar?cites=606901395225960128&as_sdt=2005&sciodt=0,5&hl=en",753,25-01-21,,,,,,,,,62,3.1,16,4,20
0,J Al Dallal,Identifying Refactoring Opportunities in Object-Oriented Code: A Systematic Literature,,isc.ku.edu.kw,,http://www.isc.ku.edu.kw/drjehad/pdfs/identifying%20refactoring%20opprtunities%20IST.pdf,,754,25-01-21,PDF,,,,,,,,0,0,0,1,
27,R Warburton,Java 8 Lambdas: Pragmatic Functional Programming,2014,,books.google.com,https://books.google.com/books?hl=en&lr=&id=FKUdAwAAQBAJ&oi=fnd&pg=PR2&dq=%22api+evolution%22&ots=5kYIa8HdWd&sig=dm37eKcNZQyjZ1hZV76YxRhXIg0,"https://scholar.google.com/scholar?cites=17652271639355727192&as_sdt=2005&sciodt=0,5&hl=en",755,25-01-21,BOOK,,,,,,,,27,3.86,27,1,7
1,"B Marx, J Valim, B Tate",Adopting Elixir: From Concept to Production,2018,,books.google.com,https://books.google.com/books?hl=en&lr=&id=F_tUDwAAQBAJ&oi=fnd&pg=PT11&dq=%22api+evolution%22&ots=JptoAhkkTF&sig=RNJngPAXFcYRNcpvGh8HwdkmSj0,"https://scholar.google.com/scholar?cites=2026055835645565970&as_sdt=2005&sciodt=0,5&hl=en",756,25-01-21,BOOK,,,,,,,,1,0.33,0,3,3
0,"HG Nunes, MAS Bigonha, KAM Ferreira, FA Madureira",Um Método para Identificação de Bad Smells a partir de Diagramas de Classes,,llp.dcc.ufmg.br,,http://llp.dcc.ufmg.br/Publications/Art2013/130927_1-VEM-Henrique.pdf,,757,25-01-21,PDF,,,,,,,,0,0,0,4,
0,"WV Wheeling, AL Birmingham",Jeffrey G. Gray,,Work,academia.edu,https://www.academia.edu/download/40588638/The_Role_of_Reuse_in_Introducing_Softwar20151202-28991-1ukyee7.pdf,,758,25-01-21,PDF,,,,,,,,0,0,0,2,
8,DE Baisley,Method for merging repository updates with incomplete work in progress,2001,"US Patent 6,275,787",Google Patents,https://patents.google.com/patent/US6275787B1/en,"https://scholar.google.com/scholar?cites=7886578680305895697&as_sdt=2005&sciodt=0,5&hl=en",759,25-01-21,,,,,,,,,8,0.4,8,1,20
13,"J Foley, S Ketineni",Graphical distributed make tool methods apparatus and computer program products,1999,"US Patent 5,973,687",Google Patents,https://patents.google.com/patent/US5973687A/en,"https://scholar.google.com/scholar?cites=6666184038521113538&as_sdt=2005&sciodt=0,5&hl=en",760,25-01-21,,,,,,,,,13,0.59,7,2,22
0,"A Kumar, C Taylor",Declarative cluster management,2018,"US Patent 9,959,288",Google Patents,https://patents.google.com/patent/US9959288B2/en,,761,25-01-21,,,,,,,,,0,0,0,2,3
16,"J Koehler, JM Kuester, K Ryndina, ...",Automatic composition of model transformations,2011,US Patent …,Google Patents,https://patents.google.com/patent/US8042091B2/en,"https://scholar.google.com/scholar?cites=14501843548366728962&as_sdt=2005&sciodt=0,5&hl=en",762,25-01-21,,,,,,,,,16,1.6,4,4,10
0,JV Vargas,Mobile Actors Supporting Reconfigurable Applications in Open Peer-to-Peer Networks,,emn.fr,,http://web.emn.fr/x-info/emoose/alumni/thesis/jvallejos.pdf,,763,25-01-21,PDF,,,,,,,,0,0,0,1,
9,"GJ Czajkowski, LP Daynès",Portable detection of start and completion of object construction,2009,"US Patent 7,624,381",Google Patents,https://patents.google.com/patent/US7624381B1/en,"https://scholar.google.com/scholar?cites=17700610468261774406&as_sdt=2005&sciodt=0,5&hl=en",764,25-01-21,,,,,,,,,9,0.75,5,2,12
1,DW Ge,Method of adding client server automation to computer languages for cloud computing,2017,"US Patent 9,729,677",Google Patents,https://patents.google.com/patent/US9729677B2/en,"https://scholar.google.com/scholar?cites=10111428802499379481&as_sdt=2005&sciodt=0,5&hl=en",765,25-01-21,,,,,,,,,1,0.25,1,1,4
15,"P Eriksson, M Larsson",Method for isolating a fault from error messages,2006,"US Patent 7,124,060",Google Patents,https://patents.google.com/patent/US7124060B1/en,"https://scholar.google.com/scholar?cites=13353874332715325067&as_sdt=2005&sciodt=0,5&hl=en",766,25-01-21,,,,,,,,,15,1,8,2,15
24,SW Porter,Usage characteristic based software customization,2002,"US Patent 6,357,040",Google Patents,https://patents.google.com/patent/US6357040B1/en,"https://scholar.google.com/scholar?cites=15322829734438905784&as_sdt=2005&sciodt=0,5&hl=en",767,25-01-21,,,,,,,,,24,1.26,24,1,19
29,KM Curran,Systems and methods for processing non-functional commentary of computer source code,2010,"US Patent 7,853,924",Google Patents,https://patents.google.com/patent/US7853924B2/en,"https://scholar.google.com/scholar?cites=15808118568172239821&as_sdt=2005&sciodt=0,5&hl=en",768,25-01-21,,,,,,,,,29,2.64,29,1,11
28,"SP Burke, BK Pepin",Undo infrastructure,2007,"US Patent 7,207,034",Google Patents,https://patents.google.com/patent/US7207034B2/en,"https://scholar.google.com/scholar?cites=4562923369784626039&as_sdt=2005&sciodt=0,5&hl=en",769,25-01-21,,,,,,,,,28,2,14,2,14
21,"JA Moore, JP Stefaniak, LD Sulgrove",Method for synchronizing JAVA with UML in a version configuration management system,2004,"US Patent 6,701,517",Google Patents,https://patents.google.com/patent/US6701517B1/en,"https://scholar.google.com/scholar?cites=16629478678791911573&as_sdt=2005&sciodt=0,5&hl=en",770,25-01-21,,,,,,,,,21,1.24,7,3,17
22,"AD Tseitlin, D Kearns, M Hastings",Deployment,2015,"US Patent 9,075,596",Google Patents,https://patents.google.com/patent/US9075596B2/en,"https://scholar.google.com/scholar?cites=14861776303042885680&as_sdt=2005&sciodt=0,5&hl=en",771,25-01-21,,,,,,,,,22,3.67,7,3,6
14,M Herrmannsdörfer,Evolutionary metamodeling,2011,,mediatum.ub.tum.de,https://mediatum.ub.tum.de/1080303,"https://scholar.google.com/scholar?cites=3551934814578761345&as_sdt=2005&sciodt=0,5&hl=en",772,25-01-21,,,,,,,,,14,1.4,14,1,10
8,"M Kleine, R Hirschfeld, G Bracha",An abstraction for version control systems,2012,,books.google.com,https://books.google.com/books?hl=en&lr=&id=_4-Qdmlf1xIC&oi=fnd&pg=PP5&dq=%22api+evolution%22&ots=UpKSHiuZQg&sig=0PXuvHPhODv5hsQ1IGtVBOjXosM,"https://scholar.google.com/scholar?cites=13110356381296506448&as_sdt=2005&sciodt=0,5&hl=en",773,25-01-21,BOOK,,,,,,,,8,0.89,3,3,9
7,"ELG Alves, M Song, T Massoni, ...",Refactoring inspection support for manual refactoring edits,2017,IEEE Transactions …,ieeexplore.ieee.org,https://ieeexplore.ieee.org/abstract/document/7874212/,"https://scholar.google.com/scholar?cites=2432821078721902461&as_sdt=2005&sciodt=0,5&hl=en",774,25-01-21,,,,,,,,,7,1.75,2,4,4
0,ME Chaffin,Code generator tool for building software applications with reusable components,2017,"US Patent 9,678,727",Google Patents,https://patents.google.com/patent/US9678727B1/en,,775,25-01-21,,,,,,,,,0,0,0,1,4
12,"L Holloway, W Kobrosly, N Malik, ...",Integrated project tracking tool for integrated development environment,2006,US Patent App. 10 …,Google Patents,https://patents.google.com/patent/US20060041856A1/en,"https://scholar.google.com/scholar?cites=18404322821589855775&as_sdt=2005&sciodt=0,5&hl=en",776,25-01-21,,,,,,,,,12,0.8,3,4,15
40,"J King, A Oursland",Analysis of dynamic elements in bounded time,2013,"US Patent 8,533,669",Google Patents,https://patents.google.com/patent/US8533669B2/en,"https://scholar.google.com/scholar?cites=421347408431931312&as_sdt=2005&sciodt=0,5&hl=en",777,25-01-21,,,,,,,,,40,5,20,2,8
14,"S Ramani, RA Relyea, JL Bogdan",System and method for defining and using subclasses declaratively within markup,2006,"US Patent 7,120,618",Google Patents,https://patents.google.com/patent/US7120618B2/en,"https://scholar.google.com/scholar?cites=12911777375795324542&as_sdt=2005&sciodt=0,5&hl=en",778,25-01-21,,,,,,,,,14,0.93,5,3,15
2,A Vázquez Ingelmo,Aplicación de Ingeniería de Dominio para la generación de dashboards personalizados,2018,,repositorio.grial.eu,https://repositorio.grial.eu/handle/grial/1300,"https://scholar.google.com/scholar?cites=12563333895774019927&as_sdt=2005&sciodt=0,5&hl=en",779,25-01-21,,,,,,,,,2,0.67,2,1,3
0,"WV Wheeling, AL Birmingham","Jeffrey G. Gray, Ph. D.",,Work,academia.edu,https://www.academia.edu/download/38083332/cv.pdf,,780,25-01-21,PDF,,,,,,,,0,0,0,2,
10,"J Ou, CB Chan",Detecting differences between high level block diagram models,2012,"US Patent 8,156,459",Google Patents,https://patents.google.com/patent/US8156459B1/en,"https://scholar.google.com/scholar?cites=5409762998216556299&as_sdt=2005&sciodt=0,5&hl=en",781,25-01-21,,,,,,,,,10,1.11,5,2,9
13,"K Fukuda, T Nakaike, H Takagi, T Ito",Method for generating document components and managing same,2009,"US Patent 7,519,956",Google Patents,https://patents.google.com/patent/US7519956B2/en,"https://scholar.google.com/scholar?cites=6403053374016526145&as_sdt=2005&sciodt=0,5&hl=en",782,25-01-21,,,,,,,,,13,1.08,3,4,12
0,"Y Padiolean, L Tan",A Taxonomy of Comments,2008,,opera.ucsd.edu,http://opera.ucsd.edu/CComment/taxonomy-report.pdf,,783,25-01-21,PDF,,,,,,,,0,0,0,2,13
15,"BR Baker, BO Madapusi",Extensible user interface framework for a componentized application environment,2010,"US Patent 7,765,485",Google Patents,https://patents.google.com/patent/US7765485B2/en,"https://scholar.google.com/scholar?cites=423500292165144674&as_sdt=2005&sciodt=0,5&hl=en",784,25-01-21,,,,,,,,,15,1.36,8,2,11
0,F Balaguer,Using frameworks to extend frameworks,2008,,search.proquest.com,https://search.proquest.com/openview/b532c892d401ce9a041adba497067c21/1?pq-origsite=gscholar&cbl=18750&diss=y,,785,25-01-21,BOOK,,,,,,,,0,0,0,1,13
0,"T Lecomte, A Romanovsky, M Butler, E Troubitsyna",DEPLOY Deliverable D52,2012,,deploy-project.org,http://deploy-project.org/pdf/D52.pdf,,786,25-01-21,PDF,,,,,,,,0,0,0,4,9
0,"X Liu, H Li, X Lu, T Xie, Q Mei, H Mei, F Feng",Mining Behavioral Patterns from Millions of Android Users,2017,arXiv preprint arXiv …,arxiv.org,https://arxiv.org/abs/1702.05060,,787,25-01-21,,,,,,,,,0,0,0,7,4
7,"E Jeong, C Park, K Min, Y Choi, G Lee","Apparatus and method for implementing components, and apparatus and method for verifying components",2008,"US Patent App. 11/762,390",Google Patents,https://patents.google.com/patent/US20080052685A1/en,"https://scholar.google.com/scholar?cites=6841745398582788654&as_sdt=2005&sciodt=0,5&hl=en",788,25-01-21,,,,,,,,,7,0.54,1,5,13
11,"S Saad, C Skibo",Custom assembly to extend a wizard,2009,"US Patent 7,636,912",Google Patents,https://patents.google.com/patent/US7636912B2/en,"https://scholar.google.com/scholar?cites=6913409522677414525&as_sdt=2005&sciodt=0,5&hl=en",789,25-01-21,,,,,,,,,11,0.92,6,2,12
12,"I Ragoler, A Yaeli, G Zodik",Just in time interoperability assistant,2004,"US Patent App. 10/306,918",Google Patents,https://patents.google.com/patent/US20040100494A1/en,"https://scholar.google.com/scholar?cites=17822307254652734999&as_sdt=2005&sciodt=0,5&hl=en",790,25-01-21,,,,,,,,,12,0.71,4,3,17
59,KA McIntyre,System and method of making software product deliverables,2001,"US Patent 6,178,546",Google Patents,https://patents.google.com/patent/US6178546B1/en,"https://scholar.google.com/scholar?cites=8570749056253765598&as_sdt=2005&sciodt=0,5&hl=en",791,25-01-21,,,,,,,,,59,2.95,59,1,20
5,"M Acker, FJ Stortz, J Remmel",Generating a where-used objects list for updating data,2017,"US Patent 9,658,845",Google Patents,https://patents.google.com/patent/US9658845B2/en,"https://scholar.google.com/scholar?cites=2186667496218696243&as_sdt=2005&sciodt=0,5&hl=en",792,25-01-21,,,,,,,,,5,1.25,2,3,4
21,"SH Brannen, AM Colyer, R Harrop, ...",Computer system and a method of deploying an application in a computer system,2013,US Patent …,Google Patents,https://patents.google.com/patent/US8359590B2/en,"https://scholar.google.com/scholar?cites=4550333069425358209&as_sdt=2005&sciodt=0,5&hl=en",793,25-01-21,,,,,,,,,21,2.63,5,4,8
6,S Ramani,System and method for creating a runtime connection interface for attributes and element tags defined within a subclass in a markup document,2009,"US Patent 7,516,460",Google Patents,https://patents.google.com/patent/US7516460B2/en,"https://scholar.google.com/scholar?cites=8804177199075006289&as_sdt=2005&sciodt=0,5&hl=en",794,25-01-21,,,,,,,,,6,0.5,6,1,12
15,"B McMaster, E Allen, W Bailey",Strongly-typed object oriented GUI automation framework,2006,"US Patent App. 10/972,871",Google Patents,https://patents.google.com/patent/US20060100975A1/en,"https://scholar.google.com/scholar?cites=9785100602941672916&as_sdt=2005&sciodt=0,5&hl=en",795,25-01-21,,,,,,,,,15,1,5,3,15
25,"A Ahadian, SA Brodsky, A Jamshidi, RB Nin, ...",Database connectivity and database model integration within integrated development environment tool,2015,US Patent …,Google Patents,https://patents.google.com/patent/US9047337B2/en,"https://scholar.google.com/scholar?cites=6557508923225328377&as_sdt=2005&sciodt=0,5&hl=en",796,25-01-21,,,,,,,,,25,4.17,5,5,6
0,V Vamsi Appana,Evaluating Industrial Relevance in Search Based Software Engineering Research: A Systematic Mapping Study and Survey,2017,,diva-portal.org,https://www.diva-portal.org/smash/record.jsf?pid=diva2:1081620,,797,25-01-21,,,,,,,,,0,0,0,1,4
8,"H Oumarou, N Anquetil, A Etien, ...",Identifying the exact fixing actions of static rule violation,2015,2015 IEEE 22nd …,ieeexplore.ieee.org,https://ieeexplore.ieee.org/abstract/document/7081847/,"https://scholar.google.com/scholar?cites=10699660843833174788&as_sdt=2005&sciodt=0,5&hl=en",798,25-01-21,,,,,,,,,8,1.33,2,4,6
7,"P Gerber, OJ Potter IV, MP Robinson",Test case inheritance controlled via attributes,2009,"US Patent 7,552,422",Google Patents,https://patents.google.com/patent/US7552422B2/en,"https://scholar.google.com/scholar?cites=4610116897596648507&as_sdt=2005&sciodt=0,5&hl=en",799,25-01-21,,,,,,,,,7,0.58,2,3,12
0,P Chandi,A Survey: Code Optimization using Refactoring,2013,International Journal on Computer Science and …,Citeseer,https://citeseerx.ist.psu.edu/viewdoc/download?doi=10.1.1.309.8492&rep=rep1&type=pdf,,800,25-01-21,PDF,,,,,,,,0,0,0,1,8
12,S Weichselbaum,Aspect based recovery system and method,2009,"US Patent 7,571,352",Google Patents,https://patents.google.com/patent/US7571352B2/en,"https://scholar.google.com/scholar?cites=5923734574083067232&as_sdt=2005&sciodt=0,5&hl=en",801,25-01-21,,,,,,,,,12,1,12,1,12
27,"A Snyder, RJ Mc Chesney, MW Hapner, ...",Method and apparatus for generation and installation of distributed objects on a distributed object system,2003,US Patent …,Google Patents,https://patents.google.com/patent/US6640255B1/en,"https://scholar.google.com/scholar?cites=15473443686630917708&as_sdt=2005&sciodt=0,5&hl=en",802,25-01-21,,,,,,,,,27,1.5,7,4,18
0,JC Gardey,Refactorings portables para soportar la evolución automática de código que utiliza componentes externos,2017,,sedici.unlp.edu.ar,http://sedici.unlp.edu.ar/handle/10915/72129,,803,25-01-21,,,,,,,,,0,0,0,1,4
224,"K Prete, N Rachatasumrit, N Sudan, ...",Template-based reconstruction of complex refactorings,2010,2010 IEEE International …,ieeexplore.ieee.org,https://ieeexplore.ieee.org/abstract/document/5609577/,"https://scholar.google.com/scholar?cites=17085575613310780825&as_sdt=2005&sciodt=0,5&hl=en",804,25-01-21,,,,,,,,,224,20.36,56,4,11
10,NJ Geisinger,Method and system for creating self-assembling components,2008,"US Patent 7,343,596",Google Patents,https://patents.google.com/patent/US7343596B1/en,"https://scholar.google.com/scholar?cites=4373810133897865517&as_sdt=2005&sciodt=0,5&hl=en",805,25-01-21,,,,,,,,,10,0.77,10,1,13
3,RG Sage,Executable code generated from common source code,2016,"US Patent 9,454,390",Google Patents,https://patents.google.com/patent/US9454390B2/en,"https://scholar.google.com/scholar?cites=1118987962828930579&as_sdt=2005&sciodt=0,5&hl=en",806,25-01-21,,,,,,,,,3,0.6,3,1,5
8,KT Stolee,Analysis and transformation of pipe-like web mashups for end user programmers,2010,,digitalcommons.unl.edu,https://digitalcommons.unl.edu/computerscidiss/6/,"https://scholar.google.com/scholar?cites=1367343913606267380&as_sdt=2005&sciodt=0,5&hl=en",807,25-01-21,,,,,,,,,8,0.73,8,1,11
0,IPSC SILVA,Avaliando suítes automaticamente geradas para validação de refatoramentos.,2018,,dspace.sti.ufcg.edu.br,http://dspace.sti.ufcg.edu.br:8080/jspui/handle/riufcg/1611,,808,25-01-21,,,,,,,,,0,0,0,1,3
18,"SA Brodsky, A Jamshidi, RB Nin, BG Payton, ...",Processing database queries embedded in application source code from within integrated development environment tool,2016,US Patent …,Google Patents,https://patents.google.com/patent/US9489418B2/en,"https://scholar.google.com/scholar?cites=15952934127188101705&as_sdt=2005&sciodt=0,5&hl=en",809,25-01-21,,,,,,,,,18,3.6,4,5,5
1,PRG ACCIOLY,Understanding collaboration conflicts characteristics,2018,,repositorio.ufpe.br,https://repositorio.ufpe.br/handle/123456789/32361,"https://scholar.google.com/scholar?cites=9479378819722137932&as_sdt=2005&sciodt=0,5&hl=en",810,25-01-21,,,,,,,,,1,0.33,1,1,3
7,"V Vairavan, U Bellur",Method for ensuring consistency during software development,2009,"US Patent App. 12/324,956",Google Patents,https://patents.google.com/patent/US20090144695A1/en,"https://scholar.google.com/scholar?cites=14028449513020197869&as_sdt=2005&sciodt=0,5&hl=en",811,25-01-21,,,,,,,,,7,0.58,4,2,12
42,C Kelley,Dynamically loadable phrase book libraries for spoken language grammars in an interactive system,2002,"US Patent 6,405,171",Google Patents,https://patents.google.com/patent/US6405171B1/en,"https://scholar.google.com/scholar?cites=9498341058996064554&as_sdt=2005&sciodt=0,5&hl=en",812,25-01-21,,,,,,,,,42,2.21,42,1,19
1,D Abts,Objektorientierte Sprachkonzepte,2018,Grundkurs JAVA,Springer,https://link.springer.com/chapter/10.1007/978-3-658-21907-9_3,"https://scholar.google.com/scholar?cites=1357938741275890030&as_sdt=2005&sciodt=0,5&hl=en",813,25-01-21,,,,,,,,,1,0.33,1,1,3
3,"M Fahndrich, S Lahiri, F Logozzo, ...",Semantic baselining,2018,US Patent …,Google Patents,https://patents.google.com/patent/US9904541B2/en,"https://scholar.google.com/scholar?cites=10936708007053741055&as_sdt=2005&sciodt=0,5&hl=en",814,25-01-21,,,,,,,,,3,1,1,4,3
11,J Dedecker,Ambient-Oriented Programming,2006,,Citeseer,https://citeseerx.ist.psu.edu/viewdoc/download?doi=10.1.1.118.1915&rep=rep1&type=pdf,"https://scholar.google.com/scholar?cites=4905110994846851207&as_sdt=2005&sciodt=0,5&hl=en",815,25-01-21,PDF,,,,,,,,11,0.73,11,1,15
78,"MV Avvari, PA Chin, MK Nandigama, ...",Software application test coverage analyzer,2005,US Patent …,Google Patents,https://patents.google.com/patent/US6978401B2/en,"https://scholar.google.com/scholar?cites=15060087216967153238&as_sdt=2005&sciodt=0,5&hl=en",816,25-01-21,,,,,,,,,78,4.88,20,4,16
32,"K Bhandari, D Bharti, K Pal",Generating sequence diagrams using call trees,2009,"US Patent 7,506,320",Google Patents,https://patents.google.com/patent/US7506320B2/en,"https://scholar.google.com/scholar?cites=4087330913902197940&as_sdt=2005&sciodt=0,5&hl=en",817,25-01-21,,,,,,,,,32,2.67,11,3,12
50,"E Beans, D Khuong, P Vutukuru, SS Mar",Software test case management,2013,"US Patent 8,561,036",Google Patents,https://patents.google.com/patent/US8561036B1/en,"https://scholar.google.com/scholar?cites=3163240317756688856&as_sdt=2005&sciodt=0,5&hl=en",818,25-01-21,,,,,,,,,50,6.25,13,4,8
17,WF Ng,Systems and methods for identifying a relationship between multiple interrelated applications in a mainframe environment,2012,"US Patent 8,117,500",Google Patents,https://patents.google.com/patent/US8117500B2/en,"https://scholar.google.com/scholar?cites=13171479778371092127&as_sdt=2005&sciodt=0,5&hl=en",819,25-01-21,,,,,,,,,17,1.89,17,1,9
2,Y Sawano,Asynchronous code testing,2017,"US Patent 9,569,346",Google Patents,https://patents.google.com/patent/US9569346B2/en,"https://scholar.google.com/scholar?cites=1145238303242237281&as_sdt=2005&sciodt=0,5&hl=en",820,25-01-21,,,,,,,,,2,0.5,2,1,4
7,"H Witteborg, A Charfi, T Holmes",In-place definition of software extensions,2017,"US Patent 9,542,178",Google Patents,https://patents.google.com/patent/US9542178B2/en,"https://scholar.google.com/scholar?cites=15832503007172525233&as_sdt=2005&sciodt=0,5&hl=en",821,25-01-21,,,,,,,,,7,1.75,2,3,4
52,"S Murakami, K Kiyota","Program product, method, and system for testing consistency of machine code files and source files",2009,"US Patent 7,577,946",Google Patents,https://patents.google.com/patent/US7577946B2/en,"https://scholar.google.com/scholar?cites=9498606314408664427&as_sdt=2005&sciodt=0,5&hl=en",822,25-01-21,,,,,,,,,52,4.33,26,2,12
0,"HG Nunes, MAS Bigonha, KAM Ferreira, FA Madureira",Um Método para Identificação de Bad Smells em Software a partir de Modelos UML,,llp.dcc.ufmg.br,,http://llp.dcc.ufmg.br/Publications/Art2013/126396.pdf,,823,25-01-21,PDF,,,,,,,,0,0,0,4,
3,"P Bellavite, S Chirumbolo, P Magnani, ...",Effectiveness of homeopathy in immunology and inflammation disorders: a literature overview of clinical studies,2008,Homeopath …,paolobellavite.it,http://www.paolobellavite.it/files/222_2008_effectivenesshomeofacejournal.pdf,"https://scholar.google.com/scholar?cites=1340683110485925923&as_sdt=2005&sciodt=0,5&hl=en",824,25-01-21,PDF,,,,,,,,3,0.23,1,4,13
9,"K Bhandari, D Bharti, K Pal",Generating sequence diagrams using call trees,2012,"US Patent 8,141,073",Google Patents,https://patents.google.com/patent/US8141073B2/en,"https://scholar.google.com/scholar?cites=738527183258806659&as_sdt=2005&sciodt=0,5&hl=en",825,25-01-21,,,,,,,,,9,1,3,3,9
19,"I Tsyganskiy, V Stulski, D Liakh, E Satsuta, ...",Systems and methods for identifying problems of a business application in a customer support system,2013,US Patent …,Google Patents,https://patents.google.com/patent/US8539003B2/en,"https://scholar.google.com/scholar?cites=18317090532060949203&as_sdt=2005&sciodt=0,5&hl=en",826,25-01-21,,,,,,,,,19,2.38,4,5,8
55,WD Wigger,Combining a meta data file and java source code to dynamically create java classes and javabeans,2002,"US Patent 6,427,228",Google Patents,https://patents.google.com/patent/US6427228B1/en,"https://scholar.google.com/scholar?cites=11990179352851895731&as_sdt=2005&sciodt=0,5&hl=en",827,25-01-21,,,,,,,,,55,2.89,55,1,19
14,UNO Souichi,Information processing apparatus and method of acquiring trace log,2014,"US Patent 8,745,595",Google Patents,https://patents.google.com/patent/US8745595B2/en,"https://scholar.google.com/scholar?cites=18023071918607840564&as_sdt=2005&sciodt=0,5&hl=en",828,25-01-21,,,,,,,,,14,2,14,1,7
5,"K Bhandari, D Bharti, K Pal",Generating sequence diagrams using call trees,2012,"US Patent 8,146,055",Google Patents,https://patents.google.com/patent/US8146055B2/en,"https://scholar.google.com/scholar?cites=3980989085777972586&as_sdt=2005&sciodt=0,5&hl=en",829,25-01-21,,,,,,,,,5,0.56,2,3,9
5,"K Bhandari, D Bharti, K Pal",Generating sequence diagrams using call trees,2012,"US Patent 8,171,449",Google Patents,https://patents.google.com/patent/US8171449B2/en,"https://scholar.google.com/scholar?cites=16650799272384055495&as_sdt=2005&sciodt=0,5&hl=en",830,25-01-21,,,,,,,,,5,0.56,2,3,9
113,"KW Marvin, D Bau III, RA Chavez","Methods and apparatus for building, customizing and using software abstractions of external entities",2009,"US Patent 7,516,447",Google Patents,https://patents.google.com/patent/US7516447B2/en,"https://scholar.google.com/scholar?cites=1074230158044339658&as_sdt=2005&sciodt=0,5&hl=en",831,25-01-21,,,,,,,,,113,9.42,38,3,12
6,"AD Tseitlin, D Kearns",Modularity,2007,"US Patent App. 11/426,269",Google Patents,https://patents.google.com/patent/US20070226731A1/en,"https://scholar.google.com/scholar?cites=4706884134586978054&as_sdt=2005&sciodt=0,5&hl=en",832,25-01-21,,,,,,,,,6,0.43,3,2,14
15,"A Marx, F Beck, S Diehl",Computer-aided extraction of software components,2010,2010 17th Working Conference on …,ieeexplore.ieee.org,https://ieeexplore.ieee.org/abstract/document/5645558/,"https://scholar.google.com/scholar?cites=7701253698182972327&as_sdt=2005&sciodt=0,5&hl=en",833,25-01-21,,,,,,,,,15,1.36,5,3,11
73,"P Coad, D Charisius, A Aptus","Method and system for generating, applying, and defining a pattern",2005,"US Patent 6,851,105",Google Patents,https://patents.google.com/patent/US6851105B1/en,"https://scholar.google.com/scholar?cites=4967618128038284718&as_sdt=2005&sciodt=0,5&hl=en",834,25-01-21,,,,,,,,,73,4.56,24,3,16
2,HG Nunes,Identificação de bad smells em software a partir de modelos UML,2014,,repositorio.ufmg.br,https://repositorio.ufmg.br/handle/1843/ESBF-9KHJHR,"https://scholar.google.com/scholar?cites=6526152421041724006&as_sdt=2005&sciodt=0,5&hl=en",835,25-01-21,,,,,,,,,2,0.29,2,1,7
0,P Haslett,Maintaining private views in Java,2014,,researcharchive.vuw.ac.nz,http://researcharchive.vuw.ac.nz/handle/10063/8732,,836,25-01-21,,,,,,,,,0,0,0,1,7
95,M Brassard,Component-based source code generator,2004,"US Patent 6,742,175",Google Patents,https://patents.google.com/patent/US6742175B1/en,"https://scholar.google.com/scholar?cites=11704351546377391926&as_sdt=2005&sciodt=0,5&hl=en",837,25-01-21,,,,,,,,,95,5.59,95,1,17
